{"allowlistDecision":{"names":[],"status":"blocked-on-author-decision-2"},"applicationEnvironment":{"childInheritance":"exact-overlay-state","privilegedControls":"typed-internal-config-process-env-and-host-side-channel-inert","reads":"exact-name-capsec-gated-base-plus-principal-overlay","writes":"principal-overlay-only"},"consumers":[{"branchIds":["surface.startup.env.dynamic.cpp.environ.1o5nbvk.main"],"disposition":"capture-primitive","observedKey":"startup:env:<dynamic>:cpp:::environ","sourceRefs":["src/engine/hermes_runtime.cc#::environ:dynamic:read","src/engine/hermes_runtime_process_setup.cc#::environ:dynamic:read"]},{"branchIds":["surface.startup.env.dynamic.cpp.getenvironmentstringsw.0nkk2v9.main"],"disposition":"capture-primitive","observedKey":"startup:env:<dynamic>:cpp:GetEnvironmentStringsW","sourceRefs":["src/engine/hermes_runtime.cc#GetEnvironmentStringsW:dynamic:read"]},{"branchIds":["surface.startup.env.dynamic.cpp.getenvironmentvariablea.02j1o0t.main"],"disposition":"typed-internal-dispatch","observedKey":"startup:env:<dynamic>:cpp:GetEnvironmentVariableA","sourceRefs":["src/engine/hermes_runtime.cc#GetEnvironmentVariableA:dynamic:read"]},{"branchIds":["surface.startup.env.dynamic.cpp.nsgetenviron.1witmke.main"],"disposition":"capture-primitive","observedKey":"startup:env:<dynamic>:cpp:_NSGetEnviron","sourceRefs":["src/engine/hermes_runtime.cc#_NSGetEnviron:dynamic:read","src/engine/hermes_runtime_process.cc#_NSGetEnviron:dynamic:read","src/engine/hermes_runtime_process_setup.cc#_NSGetEnviron:dynamic:read"]},{"branchIds":["surface.startup.env.dynamic.cpp.dupenv.s.13liyhy.main"],"disposition":"typed-internal-dispatch","observedKey":"startup:env:<dynamic>:cpp:_dupenv_s","sourceRefs":["src/engine/hermes_runtime_platform_windows.cc#_dupenv_s:dynamic:read"]},{"branchIds":["surface.startup.env.dynamic.cpp.environ.0bvzoxc.main"],"disposition":"capture-primitive","observedKey":"startup:env:<dynamic>:cpp:environ","sourceRefs":["src/engine/hermes_runtime_process.cc#environ:dynamic:read"]},{"branchIds":["surface.startup.env.dynamic.cpp.getenv.1kddphg.main"],"disposition":"typed-internal-dispatch","observedKey":"startup:env:<dynamic>:cpp:getenv","sourceRefs":["src/engine/hermes_runtime.cc#getenv:dynamic:read","src/engine/hermes_runtime_osinfo.cc#getenv:dynamic:read"]},{"branchIds":["surface.startup.env.dynamic.javascript.process.binding.flow.0sy2re1.main"],"disposition":"application-broker","observedKey":"startup:env:<dynamic>:javascript:process-binding-flow","sourceRefs":["packages/ibex-runtime-js/src/node/index.ts#process-binding-flow:dynamic:read","packages/ibex-runtime-js/src/node/process.ts#process-binding-flow:dynamic:read","src/builtins/cluster.js#process-binding-flow:dynamic:read","src/builtins/https.js#process-binding-flow:dynamic:read","src/builtins/os.js#process-binding-flow:dynamic:read","src/builtins/process.js#process-binding-flow:dynamic:read","src/builtins/stream.js#process-binding-flow:dynamic:read","src/builtins/tty.js#process-binding-flow:dynamic:read","src/builtins/url.js#process-binding-flow:dynamic:read","src/engine/bootstrap/compat-polyfills.js#process-binding-flow:dynamic:read","src/engine/bootstrap/exact-global.js#process-binding-flow:dynamic:read","src/engine/bootstrap/ipc-listener.js#process-binding-flow:dynamic:read","src/engine/bootstrap/module-loader.js#process-binding-flow:dynamic:read","src/engine/bootstrap/process-compat-fix.js#process-binding-flow:dynamic:read","src/engine/bootstrap/stream-enhance.js#process-binding-flow:dynamic:read"]},{"branchIds":["surface.startup.env.dynamic.javascript.process.env.1cbcogv.main"],"disposition":"application-broker","observedKey":"startup:env:<dynamic>:javascript:process.env","sourceRefs":["packages/ibex-runtime-js/src/bootstrap.ts#process.env:dynamic:read","packages/ibex-runtime-js/src/fetch/Headers.ts#process.env:dynamic:read","packages/ibex-runtime-js/src/fetch/Request.ts#process.env:dynamic:read","packages/ibex-runtime-js/src/fetch/Response.ts#process.env:dynamic:read","packages/ibex-runtime-js/src/fetch/body.ts#process.env:dynamic:read","packages/ibex-runtime-js/src/fetch/fetch.ts#process.env:dynamic:read","packages/ibex-runtime-js/src/node/process.ts#process.env:dynamic:read","packages/ibex-runtime-js/src/storage/native-root.ts#process.env:dynamic:read","packages/ibex-runtime-js/src/streams/ReadableStream.ts#process.env:dynamic:read","src/builtins/child-process.js#process.env:dynamic:read","src/builtins/cluster.js#process.env:dynamic:read","src/builtins/events.js#process.env:dynamic:read","src/builtins/http.js#process.env:dynamic:read","src/builtins/process.js#process.env:dynamic:read","src/builtins/stream.js#process.env:dynamic:read","src/builtins/tty.js#process.env:dynamic:read","src/builtins/util.js#process.env:dynamic:read","src/engine/bootstrap/compat-polyfills.js#process.env:dynamic:read","src/engine/bootstrap/exact-global.js#process.env:dynamic:read","src/engine/bootstrap/module-loader.js#process.env:dynamic:read","src/engine/bootstrap/stream-enhance.js#process.env:dynamic:read","src/engine/bootstrap/web-storage.js#process.env:dynamic:read","src/engine/bootstrap/web-streams-polyfill.js#process.env:dynamic:read"]},{"branchIds":["surface.startup.env.dynamic.javascript.process.env.0g7t2rn.main"],"disposition":"application-broker","observedKey":"startup:env:<dynamic>:javascript:process.env[]","sourceRefs":["packages/ibex-runtime-js/src/fetch/Headers.ts#process.env[]:dynamic:read","packages/ibex-runtime-js/src/fetch/Request.ts#process.env[]:dynamic:read","packages/ibex-runtime-js/src/fetch/Response.ts#process.env[]:dynamic:read","packages/ibex-runtime-js/src/fetch/body.ts#process.env[]:dynamic:read","packages/ibex-runtime-js/src/fetch/fetch.ts#process.env[]:dynamic:read","packages/ibex-runtime-js/src/streams/ReadableStream.ts#process.env[]:dynamic:read","src/builtins/child-process.js#process.env[]:dynamic:read","src/builtins/cluster.js#process.env[]:dynamic:read"]},{"branchIds":["surface.startup.env.dynamic.javascript.process.0zq1e6e.main"],"disposition":"application-broker","observedKey":"startup:env:<dynamic>:javascript:process[]","sourceRefs":["src/builtins/stream.js#process[]:dynamic:read","src/engine/bootstrap/compat-polyfills.js#process[]:dynamic:read","src/engine/bootstrap/ipc-listener.js#process[]:dynamic:read","src/engine/bootstrap/lazy-getters.js#process[]:dynamic:read","src/engine/bootstrap/process-compat-fix.js#process[]:dynamic:read"]},{"branchIds":["surface.startup.env.dynamic.rust.command.default.env.1o1kxgs.main"],"disposition":"typed-internal-dispatch","observedKey":"startup:env:<dynamic>:rust:Command::default_env","sourceRefs":["src/bin/ibex/engine/capsec_exact_fixture_evidence_batch.rs#Command::default_env:dynamic:write","src/bin/ibex/engine/hermes.rs#Command::default_env:dynamic:write","src/bin/ibex/main.rs#Command::default_env:dynamic:write","src/bin/ibex/runtime.rs#Command::default_env:dynamic:write","src/bin/ibex/session_semantics_conformance.rs#Command::default_env:dynamic:write","src/bin/ibex/session_worker.rs#Command::default_env:dynamic:write","src/bin/ibex/sfe.rs#Command::default_env:dynamic:write","src/module_loader/catalog_compiler.rs#Command::default_env:dynamic:write","src/module_loader/mod.rs#Command::default_env:dynamic:write"]},{"branchIds":["surface.startup.env.dynamic.rust.command.env.clear.0cl6ccg.main"],"disposition":"typed-internal-dispatch","observedKey":"startup:env:<dynamic>:rust:Command::env_clear","sourceRefs":["src/bin/ibex/engine/hermes.rs#Command::env_clear:dynamic:unset","src/bin/ibex/runtime.rs#Command::env_clear:dynamic:unset","src/module_loader/catalog_compiler.rs#Command::env_clear:dynamic:unset","src/module_loader/mod.rs#Command::env_clear:dynamic:unset"]},{"branchIds":["surface.startup.env.dynamic.rust.env.var.06m71te.main"],"disposition":"typed-internal-dispatch","observedKey":"startup:env:<dynamic>:rust:env::var","sourceRefs":["src/bin/ibex/main.rs#env::var:dynamic:read","src/bin/ibex/subprocess.rs#env::var:dynamic:read"]},{"branchIds":["surface.startup.env.dynamic.rust.env.var.os.11lyypt.main"],"disposition":"typed-internal-dispatch","observedKey":"startup:env:<dynamic>:rust:env::var_os","sourceRefs":["src/host/abi.rs#env::var_os:dynamic:read","src/host/mod.rs#env::var_os:dynamic:read"]},{"branchIds":["surface.startup.env.dynamic.rust.env.vars.os.016blc6.main"],"disposition":"capture-primitive","observedKey":"startup:env:<dynamic>:rust:env::vars_os","sourceRefs":["src/host/process.rs#env::vars_os:dynamic:read"]},{"branchIds":["surface.startup.env.appdata.0scqvtm.main"],"disposition":"privileged-control","name":"APPDATA","observedKey":"startup:env:APPDATA","sourceRefs":["src/bin/ibex/runtime.rs#Command::env:APPDATA:write","src/module_loader/mod.rs#Command::env:APPDATA:write"]},{"branchIds":["surface.startup.env.bun.runtime.transpiler.cache.path.18dr089.main"],"disposition":"privileged-control","name":"BUN_RUNTIME_TRANSPILER_CACHE_PATH","observedKey":"startup:env:BUN_RUNTIME_TRANSPILER_CACHE_PATH","sourceRefs":["src/bin/ibex/runtime.rs#Command::env:BUN_RUNTIME_TRANSPILER_CACHE_PATH:write","src/module_loader/mod.rs#Command::env:BUN_RUNTIME_TRANSPILER_CACHE_PATH:write"]},{"branchIds":["surface.startup.env.clicolor.force.07xv92a.main"],"disposition":"privileged-control","name":"CLICOLOR_FORCE","observedKey":"startup:env:CLICOLOR_FORCE","sourceRefs":["src/bin/ibex/terminal_session.rs#env::var_os:CLICOLOR_FORCE:read"]},{"branchIds":["surface.startup.env.colorterm.1c641i4.main"],"disposition":"application-behavior","name":"COLORTERM","observedKey":"startup:env:COLORTERM","sourceRefs":["src/builtins/tty.js#process.env:COLORTERM:read","src/engine/bootstrap/stream-enhance.js#process.env:COLORTERM:read"]},{"branchIds":["surface.startup.env.columns.0htd3h6.main"],"disposition":"application-behavior","name":"COLUMNS","observedKey":"startup:env:COLUMNS","sourceRefs":["src/builtins/tty.js#process.env:COLUMNS:read"]},{"branchIds":["surface.startup.env.comspec.1vitmnr.main"],"disposition":"